"Id","Title","Description","ReleaseYear","Certification","Runtime","Country","Seasons","Genres"
"168","Facere eos rem eos ipsam fuga illo dolore voluptatem ipsam.","Rerum impedit harum consequatur.
Sunt tenetur asperiores.
Alias est consequatur illo.","1661","S","297","CYP","13","omnis, aspernatur, qui, officiis, voluptatibus"
"169","Vel est nam nobis.","Temporibus explicabo illo aut facilis pariatur.
Magnam qui vitae.
Sint laborum modi maiores vitae nihil.
Laudantium commodi magnam quaerat porro veritatis.
Assumenda eligendi aspernatur.","1440","TV-14","64","PCN","48","maxime, nihil, reiciendis, hic, pariatur"
"170","At rerum distinctio aspernatur.","Iure consequuntur eligendi sed assumenda nulla magnam eos distinctio.
Inventore voluptas nemo quo.
Eaque sunt sapiente consequuntur qui distinctio cum.
Aliquam ea doloremque assumenda impedit eum sunt eum similique.
Vel qui labore maiores ea et.","863","GP","592","MDV","48","qui, unde, in, quia, quidem"
"171","Perspiciatis aut corporis velit delectus perspiciatis autem deserunt aperiam voluptatibus.","Ratione aliquid dolor.
Vero laboriosam doloremque velit iusto velit dolorem exercitationem numquam quae.
Voluptatibus optio labore.","1269","15A","484","NLD","47","minima, est, rerum, illo, a"
"172","Reprehenderit minima voluptatem rerum totam aut labore adipisci accusantium corrupti.","Distinctio necessitatibus sapiente praesentium sed deserunt.
Autem cupiditate architecto molestiae quasi esse libero non ratione quia.","1148","PG-13","309","ITA","8","voluptatem, dolor, neque, eos, soluta"
"173","Illum molestias natus nesciunt aspernatur.","Explicabo nostrum ullam commodi minima.
Sint voluptatem sed dolor officia qui.
Veritatis molestiae rerum totam aut sed dolorem aperiam eum.","417","R18","677","TCD","32","consectetur, molestiae, placeat, accusantium, quos"
"174","Iusto excepturi molestiae.","Ab eos repellat nemo.
Earum atque aperiam quasi sapiente vero voluptatem porro.
Nihil rerum aut aut sequi recusandae.
Saepe cumque voluptatem ex totam fugit et voluptas voluptatem.","809","A","565","COD","47","omnis, laudantium, est, non, repellendus"
"175","Ut alias veritatis fuga.","Possimus alias velit distinctio libero.
Et possimus itaque accusantium ab et repellat ex.
Veniam assumenda voluptatum aut ea.
Maiores animi dolorum quidem saepe.
Laboriosam earum consequatur qui ratione libero consequuntur ea nostrum id.
Odit reiciendis voluptatem quis.","1950","12A","334","MDA","28","amet, tenetur, modi, nihil, ratione"
"176","Est atque itaque deserunt error vel nam.","Sapiente laudantium deleniti consequatur officia voluptatem.
Ut nihil praesentium.
Ducimus voluptatem minus.","2046","NC-17","876","THA","27","non, reprehenderit, aliquam, corrupti, amet"
"177","Veniam iusto est voluptas quasi.","Suscipit enim tempore autem consequatur a velit omnis voluptas.
A dicta facilis placeat accusamus et.
Ex nemo et molestias et et fuga dolor.
Consequatur nemo incidunt dicta quia sit laboriosam eos.","1522","U/A","513","BGR","13","ipsa, et, quo, quia, quo"
"178","Minima accusantium impedit eum consequuntur rerum.","Enim tempore nulla corrupti natus ipsa amet nihil.
Itaque quos qui nihil ipsam quo asperiores sint laboriosam.
Suscipit aut ullam porro distinctio amet accusamus.","607","TV-MA","895","GGY","32","qui, aut, est, quos, molestiae"
"179","Commodi occaecati beatae.","Possimus mollitia quos.
Sit ipsa repellat et earum necessitatibus sit odit ducimus minus.
Rerum eum qui.
Doloribus pariatur ullam.
Sit et nam omnis quas.
Asperiores quo dignissimos officia temporibus.","1457","R18+","321","SVK","49","voluptatibus, corrupti, corrupti, culpa, quia"
"180","Maiores saepe error blanditiis ea tempore rerum.","Omnis velit omnis.
Ut sapiente aut.
Ut voluptas veritatis voluptatem et animi.
Id est consequatur hic.
At et officiis repellendus nesciunt cupiditate cupiditate consequatur quaerat.
Veniam totam inventore quibusdam quia.","788","CA","21","NFK","22","assumenda, quos, voluptatibus, blanditiis, voluptatibus"
"181","Ea consequatur corporis ut.","Repudiandae nulla nisi debitis ducimus.
Perferendis laudantium qui laboriosam ullam dignissimos et aperiam.
Illum et sed ullam.
Qui cupiditate velit veniam optio placeat earum aperiam voluptates consectetur.","1600","PG-13","470","VUT","4","quidem, fuga, rerum, est, voluptas"
"182","Aut est magnam repellendus asperiores sunt aliquam dolorem earum reprehenderit.","Facilis ratione reiciendis ad velit consequuntur sed placeat qui sapiente.
Dolore sint et eum optio quaerat sapiente cupiditate est dolore.
Officiis natus veniam tempora voluptas sunt.
Vel dolores eius sunt rerum eum voluptatem enim sequi provident.
Aspernatur voluptas molestiae nulla dignissimos.","989","R21","656","GUF","42","maiores, voluptatem, qui, vero, voluptatem"
"183","Laudantium sit velit est totam.","Est sit enim dolorum qui temporibus.
Sapiente omnis quibusdam molestiae quo quo ut ratione eius nisi.","1080","M","475","TKL","28","quisquam, explicabo, repudiandae, iure, voluptas"
"184","Ut esse rerum facere aut cupiditate laboriosam quisquam numquam et.","Harum libero nulla error.
Autem vel architecto sapiente laboriosam accusamus facere tempora sint veniam.","332","R21","168","KNA","24","qui, ipsam, praesentium, earum, qui"
"185","Est mollitia aspernatur aspernatur repudiandae amet sed.","Quam aut et fugiat ut rerum atque esse accusamus eligendi.
Ut occaecati est ut dolore accusamus aperiam.
Consequatur est et.
Quisquam veniam accusamus nulla quia asperiores ab iste ducimus sunt.
Omnis officiis veritatis.
Quia nobis porro.","2100","M/PG","743","BIH","24","nesciunt, et, id, iusto, voluptatem"
"186","Porro illo voluptas quia est dolores.","Voluptatem inventore ut placeat aut qui quia blanditiis.
Occaecati voluptates sunt velit eum.","191","18","888","CAF","9","eos, pariatur, officiis, fugit, libero"
"187","Ut dolor aut temporibus quia aliquam necessitatibus id.","Cupiditate et repellendus aut ut optio perspiciatis rerum.
Nobis quam vel nulla laboriosam.
Delectus hic id non quia.","1015","E10+","562","GMB","6","vitae, id, neque, est, dolores"
"188","Beatae nam facere amet et.","Exercitationem qui eligendi.
Repellat libero autem nesciunt est.","369","TV-14","986","BLM","19","omnis, necessitatibus, a, aut, nulla"
"189","Minima id autem assumenda id repellat.","Repudiandae expedita ex alias voluptatem dolores quis rerum.
Odio debitis assumenda non cumque nisi quas ut quo earum.
Eius optio aut quis aspernatur molestias voluptas qui.
Et natus est.
Sed corrupti recusandae repellat et distinctio illo eligendi eos.
Excepturi harum voluptas eum sint sunt voluptatem modi maiores blanditiis.","1114","G","739","GMB","37","et, sapiente, tempore, quod, sed"
"190","Veniam qui mollitia quam sed provident est occaecati vel soluta.","Consequatur similique sapiente.
Deleniti rerum laboriosam sint in et tempora non suscipit.
Odit eum doloremque laboriosam quisquam.","1018","PG","76","CPV","42","aperiam, voluptatibus, dolorum, quas, numquam"
"191","Omnis est recusandae sit consectetur.","Quasi natus qui et fugit maiores quia.
Voluptas impedit voluptates nihil est.
Consectetur et voluptatem quo doloremque voluptate dolores ea.
Et excepturi sit provident dolorem.","1842","C","312","NGA","45","facilis, et, sit, cupiditate, et"
"192","Laborum tenetur consequatur perferendis.","Enim at enim ut recusandae.
Vel omnis quidem.","1980","9","885","ARE","41","dolorum, exercitationem, aut, in, minima"
"193","Delectus eaque est in delectus quas quod voluptatibus sed dignissimos.","Quas veritatis eveniet nobis error aut iusto eos aut.
Recusandae dolor quisquam nisi ipsum aut autem voluptatem et.
Sed animi laboriosam voluptatum ut.","1731","PG","135","KEN","38","corrupti, cumque, quam, rerum, fugit"
"194","Necessitatibus aspernatur dolore praesentium aut aut.","Odit in quis beatae eum magnam ipsum accusantium et.
Error fugiat suscipit optio quos quo perferendis assumenda modi voluptas.","768","MA15+","431","VCT","48","nisi, voluptatem, nemo, ut, est"
"195","Ab ut possimus exercitationem eum.","Officia neque quia id aspernatur.
Dignissimos esse mollitia voluptatem iste quia est ut doloremque.
Cumque aut in eveniet est ex nihil libero et.
Expedita quia vero dolore illum fuga.","1419","18","798","CHL","18","reprehenderit, provident, doloribus, dignissimos, porro"
"196","Quia ullam aut nisi itaque sit veniam quis.","Asperiores deserunt praesentium.
Dolorem omnis reprehenderit qui veniam.
Aut voluptates eveniet fuga maiores fuga sed.
Blanditiis et optio et.","1997","TV-14","147","VEN","35","sed, quia, vitae, sint, ducimus"
"197","Eos enim doloribus quia consequatur quidem eum nostrum animi ratione.","Et architecto aspernatur vero.
Ullam voluptatem quo.
Sit quidem incidunt officia.
Voluptates vero architecto id voluptatem.","527","PG-13","963","ESP","42","ut, impedit, sed, nobis, perspiciatis"
"198","Nulla exercitationem maxime fugiat veritatis saepe.","Aut ut ipsam debitis.
Non fugit corporis voluptas et architecto ut ut dolor commodi.
Possimus aut rerum non.","735","TV-Y7","407","TCA","31","sit, nihil, qui, minus, facere"
"199","Voluptatibus culpa voluptatem ipsum qui veniam exercitationem.","Aliquid minima nisi neque.
Rerum est et vel aliquid consequatur aut vel.
Necessitatibus ipsa consequatur sed veritatis libero officia velit omnis ut.
Aperiam aliquam dolores id molestias fuga dolorum voluptatibus est.","594","NC-17","638","TLS","27","quia, et, explicabo, saepe, tempore"
"200","Qui eveniet rerum sed mollitia reprehenderit.","Magni id harum rerum eaque hic totam voluptatem ad est.
Eum reiciendis dolores voluptas accusantium enim minima velit reprehenderit accusamus.
Sint quo at enim voluptate dolorem facere dolorum voluptas.
Impedit sint suscipit eaque voluptas reiciendis quae harum aut.
Voluptatum sit provident.
Sint repudiandae occaecati.","1984","18R","788","AUS","6","ea, eos, et, et, corrupti"
