"Id","Title","Description","ReleaseYear","Certification","Runtime","Country","Seasons","Genres"
"1","Dolor quaerat minus voluptatum et reiciendis rerum qui tenetur minus.","Quod animi placeat qui vel.
Omnis eveniet in consequatur est omnis sed.
Soluta quis ut.
A rerum dicta.
Ipsa voluptas qui beatae quibusdam magnam eum quis placeat.","840","TV-MA","823","BRB","48","labore, blanditiis, aut, consectetur, aperiam"
"2","Porro numquam fugiat reiciendis repudiandae magnam vero quam exercitationem.","Quidem tempore id consequuntur qui beatae tempora unde qui sint.
Aliquam sunt veritatis quis dignissimos quasi ipsum necessitatibus rerum architecto.
Tenetur delectus blanditiis a aliquid voluptatem occaecati.","1412","AL","369","SVN","24","hic, et, alias, et, nobis"
"3","Possimus alias quam similique praesentium autem delectus et sit assumenda.","Ipsa aperiam dicta.
Molestiae mollitia ducimus quaerat perferendis maiores.
Dolor ipsum tenetur eius minus expedita pariatur et dolores.
Reiciendis veritatis nisi aut ea non velit fugit laudantium reiciendis.
Doloremque soluta cupiditate error laudantium ipsa quia impedit corrupti.
Molestiae eum suscipit est non.","418","M","578","GRC","45","eligendi, quisquam, voluptatem, perferendis, illo"
"4","Ex fuga quam qui.","Minus earum dolorem enim.
Impedit mollitia sit sequi ut aperiam eveniet aut laudantium asperiores.
Laborum voluptatem qui ducimus sapiente esse ea aperiam ut exercitationem.
Quis voluptatem fugit.
Dolore animi velit.","1228","15A","623","PAN","46","aut, neque, magni, non, voluptatem"
"5","Qui doloribus ut odit dolores voluptas iure aut id.","Dolores dolorum eaque ut deserunt dolorem omnis dolor officiis temporibus.
Vero dolore aperiam dolor nostrum ut quia ipsa et.
Consectetur mollitia omnis deserunt ut ut vel eligendi sit et.
Quae earum in aut tenetur.","1629","R21","428","CHE","14","nobis, ut, laborum, autem, inventore"
"6","Cum minus voluptas quod voluptate.","Quia nesciunt numquam earum temporibus.
Sunt minima dignissimos molestiae et repudiandae omnis expedita quidem.
Et non necessitatibus eum.","1769","M","219","IRN","2","quae, qui, quos, asperiores, qui"
"7","Non molestiae inventore odit consequuntur sit cumque velit.","Voluptas unde consequatur maxime ea repudiandae cum consequatur ut.
Nihil laborum accusantium ut et aut repudiandae explicabo ullam.
Dolorem eum possimus facilis culpa asperiores aut quidem magnam quibusdam.","1437","GP","26","SGP","3","sapiente, et, qui, minus, culpa"
"8","Illum inventore dignissimos qui cupiditate repellendus et est deleniti.","Explicabo distinctio velit dolores sint labore dolore vel non.
Dolores rerum sequi sed.
Minus a nobis quis suscipit excepturi magni sunt aperiam totam.
Ipsam rerum sint at.
Et amet architecto asperiores voluptatem et aut.
Vero quibusdam sapiente.","634","R21","329","FSM","32","libero, dolores, possimus, eos, ut"
"9","Cum eaque laboriosam quisquam est quo.","Modi excepturi pariatur facere commodi dolore rerum quo.
Dolores non dolore tempore ea quasi dolorem.
Molestiae suscipit ut et excepturi dolore dignissimos aspernatur.
Modi doloribus itaque in eligendi nemo.","745","PG","679","VEN","16","voluptatem, eos, molestiae, tempora, dolorem"
"10","A ratione doloribus tenetur maiores iusto in et.","Unde facere explicabo non nostrum architecto rerum rerum.
Libero aut quis.","513","9","757","SLB","30","aut, officia, velit, eligendi, quia"
"11","Blanditiis inventore saepe odit sit possimus vitae.","Enim totam dolorem provident consequatur iusto vel.
Ad aut quibusdam nam aut.
Saepe voluptas omnis debitis assumenda inventore.
Eos illo quasi.","561","E","760","SWZ","29","adipisci, occaecati, recusandae, repudiandae, voluptatibus"
"12","Tenetur tenetur suscipit illum aut.","Rerum dolores distinctio incidunt eius hic culpa dolore dolorem voluptas.
Deleniti doloremque eveniet quas velit exercitationem porro fugit enim.
Sed tempora aut qui dolorum porro atque explicabo nihil.
Ex et sit ducimus enim deserunt voluptate.
Sit dolorum aut in.","472","X18","551","BTN","6","quia, atque, accusantium, facere, vero"
"13","Numquam omnis ut aut.","Veritatis et ipsa est et qui nemo.
Illo officiis impedit.
Ut veniam quam perferendis non animi aliquid sit.
Autem aut iure molestiae cupiditate eaque est quam similique.","474","C","296","ALB","43","omnis, distinctio, consectetur, accusamus, hic"
"14","Voluptas et sed cupiditate a dolorum unde ea provident.","Facilis tempora tempora dolorem fuga quo vero ad ducimus odit.
Nostrum eum officia vel enim optio.
Ipsa aut consequatur deserunt omnis.
Saepe quis non quis quas.
Non non eum.
Autem sed veritatis debitis.","8","U","207","SLB","46","rerum, harum, rerum, voluptatem, officiis"
"15","Veritatis libero omnis ea voluptatem molestiae ipsam aut non in.","Earum voluptatem deleniti quod adipisci sit est quo ut in.
Illo ut et iusto officiis doloribus qui nobis porro excepturi.
In voluptate debitis sed rerum rerum ullam veniam dolor.","567","S","779","GUY","23","nisi, necessitatibus, sed, aut, nostrum"
"16","Qui consequatur voluptas perferendis cum voluptatem.","Voluptatem consequatur nulla omnis assumenda reiciendis et veritatis at nam.
Voluptatem atque et ut officiis nostrum enim ullam vitae aspernatur.
Necessitatibus quae molestias.","1586","PG","51","GUF","4","dolorem, numquam, velit, corrupti, hic"
"17","Nihil deleniti tenetur officia quas dolorem alias iure.","Veritatis id vel quam ipsam sed.
Reprehenderit necessitatibus et inventore.
Tempore corrupti possimus placeat aliquam.","639","E10+","142","XKX","27","laborum, quia, veniam, eaque, perspiciatis"
"18","Aut illo et repellendus modi.","Commodi dolore id eligendi repellendus modi.
Quia aliquam sed tempore nam.
Laboriosam aut et hic.
Saepe repellat minima ducimus cupiditate hic earum laudantium soluta.
Veritatis qui dolore adipisci.","1088","T","863","UMI","16","in, reprehenderit, eum, odit, architecto"
"19","Tempore quo odio.","Doloribus et minima sunt voluptatum fugiat magnam illum.
Laudantium eum aliquam qui est dicta asperiores.
Dolorum provident facere itaque nemo autem.","629","TV-G","727","MEX","11","dicta, voluptas, commodi, quis, amet"
"20","Nulla sit aut sit labore vitae.","Expedita debitis officiis et autem dolores officia.
Et maxime sint.
Eaque in aut et in perferendis a repellat voluptatem fuga.","1319","R","203","KIR","28","temporibus, aliquam, enim, enim, ea"
"21","Vero natus ea.","Id beatae impedit consequuntur sed molestiae omnis.
Tempore cumque laudantium.
Accusamus aperiam et vero est qui harum voluptatem omnis.","462","M","830","NCL","16","velit, dicta, amet, consectetur, enim"
"22","Aut accusamus id atque vel qui iure suscipit aut in.","Blanditiis voluptatem quo voluptas expedita tempora voluptatum et.
Eum quibusdam pariatur soluta quibusdam consequatur consequatur sed.
Quibusdam labore optio optio tempora et magni saepe temporibus.","774","CA","636","LTU","15","non, fuga, est, natus, quasi"
"23","Iste incidunt dolor aut eligendi voluptates dolor et.","Ullam voluptatem ipsa voluptatem voluptate quod dolores officia.
Totam dolores fuga corporis omnis fuga.
Deserunt ut ipsa incidunt incidunt suscipit.
Dolorum eaque alias possimus.
Aliquam labore qui repellat commodi ut eum natus beatae.","1965","X18","74","CMR","43","at, vero, aut, tempore, ipsa"
"24","Qui velit nam quia sit.","Qui dolor vel ut explicabo dolores et.
Mollitia quidem numquam fuga perspiciatis dignissimos debitis et voluptatum.
Ut fuga et aut.
Explicabo natus occaecati repudiandae voluptas placeat veniam.
Et occaecati repudiandae cum excepturi.","115","U/A","742","TZA","47","hic, similique, earum, ab, et"
"25","Voluptas quia expedita ab quibusdam reprehenderit sint nobis porro aliquid.","Odio sit eligendi velit quo quia.
Doloribus architecto nisi voluptas totam libero sint veniam architecto.
Expedita delectus a et veniam temporibus et vel eius et.
Sed labore dicta nostrum similique mollitia quisquam asperiores laudantium.
Veniam itaque ut dolor accusantium quia qui autem et eos.
Cupiditate nulla rem corporis nostrum.","1980","R18","576","TKL","3","odio, rerum, omnis, quia, est"
"26","Modi fuga numquam dolores rerum.","Soluta ea architecto nostrum hic ipsum cumque rerum ab voluptatem.
Perspiciatis sequi exercitationem autem necessitatibus aperiam fugit voluptas.
Qui reiciendis quibusdam molestiae soluta sed sed qui.","822","12","386","BLM","29","quod, aut, vero, vitae, dicta"
"27","Consequatur molestias praesentium quibusdam incidunt.","Numquam doloribus ut sit doloremque.
Et magni mollitia labore ut aut repellat officiis possimus sapiente.
Est qui saepe nihil minus explicabo.
Aliquid id fugiat odit reprehenderit quo cupiditate ut.
Aliquid omnis qui vero ut occaecati aperiam quo consectetur.
Voluptas et omnis.","1261","R18+","761","YEM","29","voluptatum, quis, quidem, ex, consequuntur"
"28","Fuga minus dolor nulla doloremque at ut voluptate enim et.","Dolorem nostrum exercitationem cum.
Quae architecto repudiandae sint sit et eius.
Qui qui aspernatur dicta doloribus cumque repudiandae doloribus omnis.
Eaque dolorum aliquid perspiciatis neque a itaque.
Quo repellendus laboriosam.
Quas unde officiis et eum aut et voluptatibus.","1040","R16","3","SLB","-1","quaerat, sit, eaque, nihil, itaque"
"29","Consequatur doloribus debitis et ut dicta nemo.","Sapiente quisquam voluptatum rerum dolores itaque rerum consequatur.
Voluptatem iure nemo veritatis.
Possimus eveniet expedita eveniet.
Distinctio rem error.
Doloremque dicta veritatis non.","1295","NC-17","844","EST","22","fugiat, ab, qui, iusto, distinctio"
"30","Velit iste recusandae incidunt occaecati ad.","Soluta ut id nemo.
Et esse dicta quis architecto est laboriosam magni omnis.
Veniam et deleniti accusantium veritatis.
Et ut asperiores aliquam ut veniam minima.","7","PG","858","BTN","21","ipsam, omnis, deleniti, voluptatem, fuga"
"31","Fugiat omnis dolores.","Eos natus sapiente expedita.
Ipsam eius quibusdam officiis dicta laborum earum corrupti facere architecto.
Voluptatem unde libero necessitatibus autem delectus eos.
Voluptatem odio fugit ut facilis consequatur.","1354","M","693","CUW","36","et, laudantium, et, voluptas, explicabo"
"32","Et non molestias quis minus error molestiae quibusdam iste.","Ratione cumque asperiores et accusamus soluta alias maxime dolor est.
Consequatur voluptatem consequatur quasi doloribus excepturi.","1179","U/A","874","ABW","12","eos, doloribus, repudiandae, enim, nihil"
"33","Quis facere dolorum rerum inventore ut ullam repellendus.","Dolore impedit reprehenderit facilis occaecati laboriosam doloremque repudiandae.
Cum deserunt exercitationem.
Qui sint esse rem.
Libero ut eius et illum cum rem est.
Consequatur ad excepturi non.
Ullam est accusamus non odio enim id voluptatibus.","1852","TV-Y7","164","BLM","33","soluta, id, voluptates, amet, voluptas"
"34","Nemo odio voluptatem reprehenderit aut enim soluta voluptas quibusdam.","Eos porro aut voluptates nihil.
Nostrum ab eum voluptatum.
Sit animi qui omnis sed quis minima enim quo.","1814","15A","993","PYF","26","ea, earum, in, ad, voluptatem"
"35","Accusantium sequi harum et minus.","Qui quae aut fugit.
Velit qui architecto commodi et.
Ex id esse repellendus dolor expedita.
Mollitia aut atque eius cumque enim nihil sed magnam.
Sint quibusdam magnam et enim fugit nesciunt consequuntur.
Dolor nobis voluptatem ut quia et nemo expedita velit atque.","1272","T","826","ETH","47","quia, accusamus, dolor, expedita, qui"
"36","Nam et eveniet qui occaecati aliquam eos nesciunt omnis.","Ea dolor quia consequuntur.
Aliquam vitae animi atque repellendus iste.","2065","6","602","AND","14","ut, nobis, consequatur, consequuntur, architecto"
"37","Nemo dolorem delectus quisquam quos magni voluptates voluptatem molestias et.","Ab cumque voluptatem nobis ex repudiandae alias dolores.
Tempore eaque culpa.
Aspernatur ratione illo reiciendis at.","309","15A","379","CIV","0","aut, labore, non, quia, vitae"
"38","Nihil dolores quis quod rerum qui corporis quis vero reiciendis.","Aspernatur recusandae porro qui nemo ullam autem.
Natus in voluptatem.","1607","PG-13","237","NIU","21","amet, vel, corporis, eos, voluptas"
"39","Rerum at delectus tenetur ut veritatis.","Non alias accusantium repellat consequatur et.
Officiis iure similique voluptates et eius aspernatur.
Ea id numquam ut commodi eum.
Non eaque vel.
Possimus rerum consequatur sit ducimus tenetur repellat harum aliquid.
Dolores voluptatem delectus impedit minus blanditiis nostrum quo quia.","728","6","997","XKX","27","rerum, quisquam, voluptas, quaerat, at"
"40","Consectetur sunt occaecati fuga qui.","Nemo at saepe qui et voluptatum sed at voluptatum voluptas.
Cum nobis suscipit accusantium consequatur sapiente alias et ut.","1811","GP","339","BGD","48","vero, veritatis, ducimus, sunt, sunt"
"41","Rem et et placeat vel.","Quis sed maiores.
Reprehenderit quis facilis explicabo sunt.
Rerum suscipit unde suscipit enim inventore aliquid dignissimos et.","892","MA15+","61","LCA","31","ut, doloremque, ipsa, est, eos"
"42","Reprehenderit sit alias non fugit iste.","Enim quia aut similique sit minima eos adipisci.
Ratione doloribus nihil tempore sit vel eos.
Aperiam libero adipisci beatae fuga.
Assumenda quisquam saepe.","1247","M","749","KAZ","17","voluptatem, unde, sint, ullam, doloribus"
"43","Dicta autem accusamus eligendi omnis.","Non quisquam quod expedita cum.
Aspernatur aliquid quia earum aut omnis tempore sequi.
Ipsa inventore et nihil ut vel.
Hic quibusdam soluta fugiat est ea nobis quis repudiandae.
Ipsum quia ea nobis molestiae natus est.
Omnis laborum corporis.","11","PG","577","ARG","23","consequuntur, sit, labore, fuga, sit"
"44","Perferendis ratione soluta autem repellat ea facere voluptas.","Temporibus in libero sit laborum et harum autem est expedita.
Ut dicta eligendi nihil quae libero.
Molestias ut qui minima deserunt quo quo dicta perspiciatis et.
Commodi enim sequi similique iste ut non earum sit.
Amet excepturi sunt eum facere quam alias quae.
Ut quos molestiae.","1692","TV-G","136","MDV","23","reprehenderit, aliquam, tempore, ut, non"
"45","Delectus neque reprehenderit harum sint autem.","Vitae soluta ex eligendi aliquam.
Nulla sed aut.","749","X18","598","GAB","2","nesciunt, dolorum, ab, possimus, quae"
"46","Vitae deserunt ut expedita alias aut corrupti voluptatem et.","Ut soluta architecto nesciunt et temporibus unde veniam sunt aspernatur.
Doloribus qui deleniti qui non vel pariatur rerum quia repudiandae.","20","AL","569","PER","1","ratione, quis, sunt, sunt, molestiae"
"47","Laudantium quaerat quis dignissimos expedita.","Blanditiis sed voluptas iure necessitatibus et ut voluptatibus voluptas.
Autem labore recusandae culpa.
Minima laudantium asperiores.
Velit laboriosam mollitia suscipit accusamus rerum explicabo eos et.
Dolores ut aut delectus ab est maxime provident non consequatur.
Explicabo id optio labore dolores illum ut et labore animi.","1693","15A","72","MYT","30","modi, perspiciatis, quibusdam, doloremque, vitae"
"48","Illum quos et excepturi et occaecati asperiores rerum.","Possimus est soluta similique.
Velit pariatur et vero eos magnam et deserunt inventore quia.
Rerum dolorum consectetur laboriosam nam sed.
Amet nam possimus.
Ex et aut inventore et sit tempora aut quo rem.","929","R16","298","ATG","40","laudantium, officia, dicta, enim, neque"
"49","Est voluptates in quo tempore doloremque voluptatem harum distinctio minus.","Dolorem id culpa.
Dolore eligendi velit dolor aut consectetur quod.","635","A","357","VEN","27","assumenda, sapiente, excepturi, sed, sunt"
"50","Ut sapiente et ut magnam consequatur voluptates rerum sequi.","Enim quidem ipsam aut quia nihil eius illum quisquam.
Iste sed occaecati blanditiis fuga.
Non omnis possimus ut dolor in neque reiciendis nihil dolorem.","1398","PG","412","BOL","18","enim, dolor, ut, ut, dicta"
"51","Esse quis accusamus sed qui distinctio.","Eum et itaque nemo aut non sapiente et mollitia ut.
Fugiat optio qui blanditiis nesciunt sunt beatae.
Sunt ea consequatur molestiae a sapiente.
Id dolor dolorem assumenda et.
Animi ipsam non ut odio aliquid repellat rerum temporibus quo.
Sit saepe reiciendis voluptatibus fugit dignissimos rem officia quaerat dolorem.","1533","A","599","ARM","37","qui, occaecati, qui, molestiae, iusto"
"52","Accusamus voluptatem inventore veritatis.","Eius non quos voluptatem quidem neque.
Rem qui et velit nemo.","1101","TV-PG","280","ATG","20","sunt, in, qui, assumenda, minus"
"53","Quia exercitationem quae possimus.","Voluptate quia velit nihil.
Rerum tempore enim maiores praesentium et sint.
Quidem repudiandae quae id quaerat et.
Autem iusto molestiae quos eligendi.
Repellat impedit ad tenetur quae rem voluptatem.","1081","X18","183","DEU","34","ut, et, inventore, eveniet, fugiat"
"54","Pariatur non eum suscipit libero non sit veritatis in.","Veniam excepturi natus tenetur laboriosam minima molestias.
Non rerum mollitia.","1258","TV-14","693","KEN","8","maiores, aut, impedit, est, consequatur"
"55","Laborum quo ut consequatur tempore quia quae atque ea laudantium.","Deserunt doloremque animi nam.
Voluptate officia asperiores enim tempora atque est.
Mollitia corrupti odio omnis.
Reprehenderit quod commodi.
Et expedita voluptatem.","791","GP","265","REU","29","amet, doloribus, dolore, inventore, facilis"
"56","Natus sint quo ut id.","Dignissimos et cum qui odit asperiores.
Animi tempore qui beatae in at.
Enim sunt illum et nemo.
Ut ut sit nostrum dolorem iste non praesentium numquam.
Voluptas omnis dicta voluptas.","1033","G","747","USA","47","sint, porro, et, voluptate, autem"
"57","Quis ut quo minima magni dicta cupiditate.","Illum velit dolorum nisi non et.
Odit aperiam possimus fuga eos optio eveniet repellendus.","1444","S","916","CUW","27","sunt, dolorem, et, quo, ex"
"58","Voluptatem tempore dignissimos quo praesentium facere eaque.","Molestiae tenetur maxime.
Quia molestiae dolorum eum vel veritatis.
Ipsa dolorem provident assumenda necessitatibus.
Ipsam voluptate nesciunt praesentium et.","91","R","560","GNB","25","ea, vel, autem, tempore, tempora"
"59","Sed quisquam quaerat est sit.","Impedit accusantium quas voluptatibus sed consequatur eius deleniti earum.
Eius dolorem est odit porro ut minus omnis culpa.","385","E","216","LVA","13","voluptas, pariatur, animi, aut, adipisci"
"60","Hic a adipisci soluta velit placeat debitis inventore.","Autem voluptatem nostrum sit rerum iure nisi rerum.
Ut totam illum accusantium.
Quos nisi modi nisi minus amet exercitationem.","391","EC","5","LSO","50","sed, eos, recusandae, ut, molestias"
"61","Inventore corrupti ea quis architecto saepe praesentium.","Velit quasi veniam sapiente debitis.
Totam soluta reiciendis repudiandae ad.
Beatae consectetur aut.","591","18","605","ARE","43","ipsam, ab, autem, laudantium, et"
"62","Incidunt nihil tempore aut harum et.","Laboriosam excepturi ipsam vero.
Enim nam omnis sit eos et quaerat quis sapiente.
At quaerat quod dolor atque.
Officia sed similique vero cumque et suscipit deserunt harum est.","1984","M","76","PLW","9","molestiae, dolorem, corporis, nulla, facere"
"63","Voluptatibus voluptatem ullam facilis ullam.","Aspernatur consequatur molestiae quis consequatur voluptatum.
Eum enim sunt temporibus sequi.
Non ipsam harum magnam aut dolores aut.
Voluptatibus quas sunt consectetur aspernatur voluptatum.","991","G","775","ASM","24","sapiente, qui, dolores, consectetur, nam"
"64","Alias ut assumenda adipisci deleniti animi.","Est corporis laborum quos pariatur.
Vel omnis animi hic officia.
Consectetur dolores dolor voluptatem eos iure qui.
Explicabo ut accusamus quo in.","1953","PG-13","941","ARE","13","sed, voluptas, temporibus, praesentium, voluptatum"
"65","Et perferendis magnam deleniti adipisci qui voluptatem recusandae repudiandae.","Quis aperiam perferendis dolorem harum ut.
Non fugiat saepe.","32","6","652","NLD","7","optio, consequuntur, delectus, omnis, nesciunt"
"66","Eum voluptas deleniti ullam esse et.","Velit ducimus minus incidunt odit.
Et odit non voluptatem et.
Aut in optio exercitationem est omnis.
Quod aut rem.","9","G","624","MEX","42","velit, quia, expedita, et, corporis"
"67","Nulla et omnis delectus voluptas labore.","Et cupiditate deserunt aut sunt tempora id voluptatum architecto.
Aut cupiditate et laudantium et maiores.","1108","TV-Y","951","CIV","22","cumque, nulla, ut, ipsa, perspiciatis"
"68","Quidem sit omnis est fuga.","Sunt dolor harum magnam.
Repudiandae consectetur soluta maiores voluptates.
Quia at perspiciatis doloribus iste ut nulla nemo.
Veniam ipsum recusandae id.
Asperiores aspernatur quidem natus itaque asperiores.
Sed quia ullam aut dolorem ut perspiciatis dolor.","164","R","853","PHL","42","corrupti, unde, facere, aut, quae"
"69","Doloribus omnis et blanditiis ut.","Ex ut et repellendus nisi.
Fugiat est labore qui soluta.
Deleniti et ut sequi sed minus dolorem ut.
Consequatur quaerat corporis rerum aliquam.
Quos rerum quo nihil.","641","E10+","263","JEY","14","architecto, et, dolores, consequatur, distinctio"
"70","Commodi officia dolores.","Nobis libero quam quibusdam similique suscipit in qui.
Illum sunt nemo et dolor voluptatem deserunt qui non.
Aliquid natus laborum consequatur.
Quae explicabo aliquid quam.","1340","R18+","700","ITA","21","inventore, voluptate, ut, adipisci, doloremque"
"71","Et a nulla ipsa exercitationem quas ullam dolor.","Nostrum fuga est quo sed fuga.
Quis totam quo nam a ut quis architecto aut labore.
Perspiciatis modi consequatur autem hic omnis aut.","1889","G","65","BRN","42","provident, sit, eaque, perferendis, et"
"72","Odio rerum reiciendis earum ut consectetur ut reprehenderit.","Rem consectetur sunt fuga quae ipsam deserunt illum rerum fugiat.
Maiores dolores nostrum numquam.
Repellendus id non cum repudiandae quis beatae quo maiores aut.","355","M/PG","123","PER","45","commodi, et, unde, dignissimos, vitae"
"73","At ab sunt tenetur nam sit.","Asperiores explicabo dolorem fugit optio.
Beatae exercitationem qui.
Cumque porro accusamus corporis aut ratione modi ut et ab.","891","S","906","VGB","49","aliquid, ut, quos, aut, ad"
"74","Sed incidunt eveniet eligendi quisquam.","Libero quod delectus quis.
Possimus eius reprehenderit ex.
Sit aperiam quas ducimus.","1559","18R","85","VUT","39","aliquam, quibusdam, eum, quas, temporibus"
"75","Voluptatum atque sit dolores qui nulla consequatur animi ratione sint.","Quidem ea tempora aut maxime.
Voluptatum possimus aliquam consequatur veniam minima.
Modi consequuntur et ut veniam nemo alias est.
Perferendis nobis sapiente at quibusdam veritatis expedita suscipit.
Animi dolore et est veniam asperiores consequatur.","416","T","531","CPV","20","ut, dolor, iste, quas, aut"
"76","Necessitatibus laborum earum.","Ad est et aut doloribus est impedit autem quidem.
Corrupti et sapiente culpa dignissimos voluptas debitis.
Totam nisi iusto veniam laborum.","1907","T","997","UGA","38","consequatur, et, dolor, qui, voluptas"
"77","Sed quod et modi omnis odio maxime.","Recusandae dolorem non vitae aliquam dolor error enim et rerum.
Commodi repudiandae adipisci dolorum.
Quia nesciunt ex perferendis.
Autem excepturi dolor qui cum.
Et consectetur fugit beatae voluptas dolor minima dolores provident.","1422","12A","268","QAT","42","natus, quos, amet, fugiat, est"
"78","Aspernatur a tempora deserunt quis eligendi laboriosam voluptatem.","Nam ipsa aspernatur enim officia est animi cupiditate repellat.
Temporibus deleniti quas nihil dolores non non molestiae sint.
Voluptas autem animi nihil sit expedita id laborum nesciunt.","151","18","734","GRC","44","modi, dolor, est, nulla, temporibus"
"79","Voluptatem autem laborum modi magni commodi enim modi.","Aut esse illo similique doloremque facere rerum dolores corrupti nihil.
Repellat dolor in est quia illo consequatur fuga consequuntur molestiae.","114","R16","707","BWA","47","itaque, placeat, omnis, debitis, laudantium"
"80","Repudiandae alias deserunt nihil voluptatem commodi.","Beatae nihil vel quae molestiae corrupti repellat maxime quia.
Rem voluptate nam mollitia incidunt odio voluptate quas.
Rerum commodi dolorem eum eveniet illo cum necessitatibus qui facere.
Eligendi quis ea sapiente sint repellat.
Eos dicta eum.
Sint et aliquid pariatur magnam debitis necessitatibus at perferendis quos.","1864","TV-G","473","PSE","32","eum, porro, velit, nemo, voluptas"
"81","Eos cupiditate eaque blanditiis dolores occaecati quibusdam corporis aspernatur ducimus.","Nulla dolores dolorum ipsam.
Consequuntur sit qui autem.","1577","R16","586","SYC","0","magnam, similique, velit, est, consequatur"
"82","Commodi voluptatem enim sed rerum quaerat aspernatur at.","Eos rerum quia possimus adipisci sed excepturi eaque maxime excepturi.
Nostrum vitae culpa alias cum quod quia dolore deleniti rerum.
Vero odit ea et reiciendis voluptate ut et et.","1258","U/A","417","GEO","41","quia, necessitatibus, explicabo, sunt, omnis"
"83","Distinctio voluptates sed officia explicabo ut dolorem.","Odit labore qui quia dignissimos ipsum minus odio rerum eos.
Repellendus voluptatem cumque rerum cupiditate exercitationem ut qui voluptatem.","1371","A","862","STP","-1","mollitia, dolores, dolorum, placeat, molestiae"
"84","Aut et expedita veritatis voluptates accusantium sunt.","Eum sapiente accusamus est consectetur et.
Ipsam perspiciatis sed sit.
Totam sed ipsam voluptates dolores.
Qui eum rem hic repellat rerum.","1873","G","550","SGS","13","eum, et, dolorem, non, doloremque"
"85","Esse ullam omnis maxime laudantium molestiae voluptas ea.","Rerum et voluptatem autem sunt eius aliquid.
Corrupti non in quia.
Voluptatum harum blanditiis nesciunt tempora sint officiis et cum.
Sunt quia incidunt vel cupiditate vel.
Nihil officia rem possimus odit officia.
Recusandae possimus sit est quidem et inventore autem.","963","TV-G","131","FRA","48","quasi, laudantium, molestiae, autem, autem"
