"Id","Title","Description","ReleaseYear","Certification","Runtime","Country","Seasons","Genres"
"86","Ullam quibusdam dolorem dolores aut qui aspernatur explicabo ex.","Sit explicabo nesciunt culpa iste.
Non nobis ad qui alias non.
Iure sunt aliquid iure.","1975","TV-Y7","136","LUX","34","molestias, quis, quo, quia, enim"
"87","Nam ullam illum non ut autem.","Explicabo at consequatur ex facere repellat in adipisci sed.
Inventore sit necessitatibus rerum et itaque.
Quia aut aliquam.","1818","C","87","FJI","17","enim, et, et, deserunt, cupiditate"
"88","Dolore blanditiis sit suscipit nostrum laudantium eum.","Aut id aliquid exercitationem voluptas fuga odit voluptas nisi eligendi.
Et id eaque ut.","1955","CA","635","BGR","9","distinctio, sit, repellat, veniam, aliquam"
"89","Voluptas accusamus architecto sapiente earum qui voluptate libero.","Nesciunt accusantium vero voluptas inventore explicabo.
Praesentium nam voluptas sunt veritatis beatae earum quam odit quia.
Totam sed ea qui et officiis.","217","U/A","127","ZWE","23","incidunt, minus, eos, quaerat, facilis"
"90","Omnis voluptatem consequatur rerum corrupti placeat.","Qui qui accusantium ab autem totam.
Eaque aut vel aperiam quo.
Vel velit voluptates.
Harum velit est repudiandae voluptates maxime placeat non.
Accusamus nulla minus enim odit eum incidunt.","2097","TV-PG","463","PRI","29","rem, delectus, sit, sit, minima"
"91","Mollitia id non qui sunt enim qui.","Reprehenderit id quod et quis nulla in.
Laboriosam sit blanditiis eaque earum recusandae cum quo.
Ut aut omnis perferendis.
Minima veritatis nisi eius debitis consequuntur.
Voluptatem harum dignissimos beatae perspiciatis sint tempora adipisci sequi ipsam.","52","PG-13","893","KGZ","21","at, et, voluptas, quis, distinctio"
"92","Pariatur quod ex esse est qui qui nulla voluptatem.","Provident sit quae praesentium alias.
Est quia ipsam dolorem quia amet eveniet.
Et et nostrum nihil.","1687","T","431","BEL","35","non, molestias, quod, sapiente, minus"
"93","Nostrum est non quas quisquam velit.","Fuga et quos alias est iure.
Cupiditate corrupti impedit ut.
Sed suscipit voluptas veritatis magni quia dolorem.
Ipsam error beatae ea pariatur distinctio ducimus et voluptatibus est.","483","TV-G","443","SGS","35","ut, ipsam, saepe, rerum, nesciunt"
"94","Explicabo alias doloribus rerum sunt velit dolor.","Quia quidem eveniet consequatur laboriosam quia laudantium.
Numquam expedita alias quae perspiciatis sint dolore similique ratione.
Ut iusto laborum itaque impedit sunt.","1394","E","384","SLB","33","qui, laudantium, id, rem, est"
"95","Voluptatem unde corrupti non.","Aut aliquam molestiae eum dolore dolorem.
Voluptate et voluptatum et in sit accusamus accusamus et.
Fugiat doloribus aliquid vitae eos.
Et assumenda nihil et voluptatem.
Distinctio maxime eveniet praesentium dicta.","466","EC","15","DMA","19","asperiores, tenetur, soluta, excepturi, magnam"
"96","Qui explicabo fugiat qui cum est doloremque.","Nihil explicabo voluptates quidem ut.
Consequatur nesciunt aut est.
Consequatur reprehenderit aspernatur autem omnis rerum omnis in.
Laborum maxime qui ad illo facilis molestiae quibusdam.
Velit eaque ut ullam quo fugiat et.
Molestias quia ea illo sint.","712","TV-PG","142","MWI","8","assumenda, non, qui, iste, hic"
"97","Qui omnis sit sequi in ea perspiciatis nihil.","Saepe eos illum magnam voluptatum qui illum non voluptas.
Qui praesentium ab nulla similique beatae culpa sit.
Suscipit repellendus esse aut natus est nemo.
Magnam eum dolor animi quisquam nostrum.","1704","C","477","BES","12","eaque, sed, distinctio, ut, vitae"
"98","Ut quia ad excepturi assumenda ratione quia animi.","Et illo quo eum cum qui fuga quae sunt.
Assumenda voluptatem eaque aliquid totam.
Doloribus distinctio culpa vel ut occaecati eveniet perspiciatis blanditiis.","363","12","302","PYF","33","aliquam, consequatur, fugiat, itaque, ullam"
"99","Laudantium sapiente unde ex soluta natus illo.","In labore aperiam voluptatem tenetur.
Consequatur velit odio impedit optio atque repudiandae nihil suscipit.
Expedita nemo corporis sed.
Provident voluptas voluptatibus omnis est quis quidem molestiae.","38","M","376","BTN","15","laudantium, et, ut, tempora, ut"
"100","Assumenda accusamus est.","Provident quos et est earum et praesentium.
Aut voluptates ipsam et fuga vel vero mollitia est.
Eveniet impedit mollitia nihil eveniet eum deserunt.
Non sunt minima delectus harum eum consequatur dicta laborum a.
Dignissimos rerum et voluptas perspiciatis qui.
Minima quibusdam non aspernatur placeat suscipit libero.","1722","PG","227","IRQ","4","error, repellendus, eius, saepe, atque"
"101","Quo nihil harum soluta inventore cupiditate delectus et porro consequatur.","Inventore labore dolorem modi tempore fuga sapiente quia fugiat asperiores.
Et eum pariatur vel aut eum et.
Ab laboriosam esse unde ipsam.
Explicabo et est sint explicabo ab ea aut.","1606","TV-MA","345","TUN","17","quis, occaecati, est, sunt, eligendi"
"102","Sed corporis dolores iure.","Sit sit consectetur laudantium blanditiis occaecati.
Voluptatem totam quo voluptatem.
Tempora asperiores pariatur.
Voluptatibus quo ut facere est mollitia et officia.","521","12","92","SPM","25","dicta, quaerat, consequatur, non, consequatur"
"103","Laudantium eius alias in labore.","Et qui soluta.
Libero aut minus maiores quos explicabo sequi eius rerum quam.","381","E","781","NLD","3","iure, dolores, aut, consectetur, voluptatem"
"104","Enim doloribus repellendus officia id temporibus.","Nisi aut omnis voluptatem voluptates dolores sit.
Consequatur ipsum quo harum aut laudantium tenetur.
Doloremque quia est necessitatibus nostrum fugit debitis ut.
Ex et quas.
Voluptatibus sequi nulla laborum voluptatibus a nihil.
Nihil est fugit.","579","EC","427","TON","24","quibusdam, molestias, non, quia, quisquam"
"105","Deserunt voluptas ipsam saepe qui ullam fuga incidunt repellendus.","Sunt sunt perspiciatis magni.
Qui nemo velit consequatur laborum in qui nam.
Perferendis itaque quae molestias iste omnis eligendi.
Quos dolor voluptatibus tempore eveniet sit architecto quisquam sequi.
Quisquam ea aliquid dolor quos facilis rerum et eius reprehenderit.
Iusto corporis fugiat minima maiores officiis necessitatibus et tempore ipsum.","1838","U","619","SGS","15","ipsam, ex, neque, amet, modi"
"106","Exercitationem sint culpa maiores sint.","Sunt est mollitia ut repellendus alias non accusamus.
Quia voluptatem non.
Temporibus in laborum sed minima totam.
Ut et ipsum quo autem illum rerum.","805","PG-13","566","TON","11","corporis, est, enim, necessitatibus, aspernatur"
"107","Autem soluta occaecati consequuntur neque ut aut suscipit.","Sed quos et voluptas ipsa soluta.
Deleniti maxime facilis suscipit magni natus vel.
Id sapiente nobis.
Maiores dolore est tempore omnis soluta voluptas inventore.","317","TV-14","572","COK","14","officia, soluta, autem, quibusdam, et"
"108","Sint magnam provident.","Voluptatum hic laborum voluptatibus et vel fugit in excepturi.
Veniam enim voluptates dolore est adipisci reiciendis repellat illo quia.
Harum consequuntur pariatur delectus optio omnis sit nisi.","1319","TV-MA","717","LAO","7","sit, sed, est, vero, sed"
"109","Ad omnis aut dignissimos expedita porro.","Ea earum corporis quia aliquid qui nihil minus provident.
Tempora qui ipsum iusto.","691","TV-Y","610","DJI","14","molestiae, distinctio, veritatis, quo, consequuntur"
"110","Incidunt et nam ipsa.","Odio atque culpa quidem iure atque omnis voluptatem consequatur id.
Itaque rem eum voluptas quidem aliquid.
Ut neque magnam explicabo magnam voluptatem consectetur vel repudiandae.
Reprehenderit quasi asperiores.
Architecto aliquid laudantium.
Et ex in corrupti molestiae repellat consequatur.","1672","S","754","SOM","8","vel, non, aperiam, ab, ut"
"111","Illum sint esse similique vitae tempore esse voluptatum laboriosam minus.","Quas reprehenderit magni delectus ut voluptatem.
Aliquid iste quod.
Placeat aut et eum.
Corrupti odio qui ullam magni amet.","214","TV-Y","155","NLD","1","alias, sunt, illo, repudiandae, expedita"
"112","Rerum numquam maiores.","Voluptatum est id impedit et et rerum ab quaerat.
In sint alias magni optio ea.
Corrupti est iusto et sint consectetur.
Aperiam impedit iusto sed commodi et eos non suscipit commodi.","804","R16","262","MKD","40","ipsum, voluptas, consequuntur, molestias, perferendis"
"113","Dolorum aliquam et tenetur.","Beatae deleniti nesciunt dolorem quibusdam dolor.
Sed rerum reiciendis.
Dolor unde alias quia nulla non quis et qui.","1998","9","597","AFG","7","quia, adipisci, voluptatem, deleniti, et"
"114","Molestiae quis omnis amet ducimus accusantium eos adipisci occaecati repellendus.","Iusto ea illo consequatur.
Voluptatum tempore deleniti fugit cum voluptas et nisi sunt.
Porro et et.
Architecto id odio maxime voluptatem iure veritatis.","1451","U/A","429","IRL","32","pariatur, quis, provident, rerum, odit"
"115","Voluptate eveniet vel assumenda dolor magni excepturi dolorem.","Delectus adipisci delectus dolorem dolorem et cumque expedita.
Fuga sed numquam odit aut eveniet rerum officia ad aut.
Suscipit et minus sequi enim est aut.
Consequuntur placeat corporis repellendus vel odit nihil non.","1085","CA","219","MEX","3","sed, quas, vitae, quae, enim"
"116","Sequi labore nulla in architecto architecto quaerat.","Cumque dolor quos.
Quas corporis cupiditate autem.
Iure eius laudantium quo.
Quia eius ratione quia est quidem deleniti voluptatem consequatur ullam.
Nostrum ducimus ex quod vitae error reiciendis ut sed.
Expedita itaque natus similique ut consequuntur ipsa id.","1497","AL","562","ECU","14","consequatur, aut, quis, est, perferendis"
"117","Vero saepe at nostrum asperiores.","Enim dolorem veniam est.
Enim ea quia neque deleniti consectetur doloribus.
Doloribus adipisci reprehenderit delectus provident dolorum fugiat.
Distinctio omnis voluptatem reprehenderit iure fugiat.
Expedita harum perferendis.
Ipsam minus architecto sint quia non nostrum dolor mollitia.","911","18R","210","MLI","29","sed, libero, nulla, nemo, sunt"
"118","Iusto quos amet quia consequatur voluptatem aliquam autem repellendus possimus.","Accusamus repellendus rem ex ratione praesentium cum et quaerat.
Est velit porro qui quia.
Ducimus aut eaque voluptatem doloremque voluptatibus fugit consequatur et expedita.
Aperiam dolore saepe incidunt occaecati sapiente nisi voluptas.","163","NC-17","292","SEN","47","molestias, architecto, consequatur, voluptatem, in"
"119","Et sunt qui soluta.","Aliquam exercitationem magni consequatur quam quo laboriosam.
Exercitationem corporis numquam nam assumenda.
Harum distinctio quia tenetur quia ad in.
Sit quo nihil voluptatum ex tempora.","2034","9","698","PRT","47","qui, ut, error, maxime, distinctio"
"120","Praesentium doloribus voluptas velit molestiae quo.","Similique dolore architecto nihil totam magni qui quo asperiores.
Odit occaecati quis quae et quia ullam est reprehenderit.
Distinctio in aperiam similique deserunt nobis culpa porro ab.
Magni et quas eaque.
Voluptas accusamus cupiditate soluta quia officia minima.
Dolor autem in dolorem a sequi aut voluptatem.","402","TV-Y","409","TGO","45","aut, alias, deleniti, quos, maiores"
"121","Dolores autem mollitia magni quibusdam numquam nesciunt aut.","Labore velit libero aperiam iste autem quis.
Quam voluptas ipsum voluptas qui veniam provident voluptatem.
Rerum similique quod similique perspiciatis officia voluptas libero nemo.","480","15A","154","BES","47","veniam, inventore, eligendi, incidunt, possimus"
"122","Eum consequatur omnis est porro aut quidem distinctio.","Nisi ut dolores mollitia incidunt enim enim.
Quia totam voluptas officia quo in et vero iure aut.
Eligendi necessitatibus sunt delectus ad neque debitis.","2020","18","239","HRV","9","laboriosam, eligendi, et, numquam, similique"
"123","Iusto iure maxime architecto provident unde.","Deserunt nam sit dolore ab pariatur nam minima dolores.
Repellat odio vitae.
Incidunt blanditiis maxime quisquam quis.
Eum sit nobis quas ipsum numquam illum.","251","R16","793","DOM","41","quasi, fugit, nihil, iusto, sint"
"124","Neque amet quo magni ipsum repellendus.","Provident quis corrupti corporis ipsum nisi quae.
Quia aliquam et maxime omnis magnam aut.","401","CA","605","FSM","15","veniam, deserunt, aut, aut, voluptas"
"125","Labore dolorum eos eum reprehenderit et et voluptas.","Dolor occaecati consequuntur occaecati debitis ea.
Consequatur voluptatum et ipsam vero tempore fugit dolorem.
Dignissimos eveniet et minima velit dolores et mollitia error.
Velit ea voluptatum maxime magnam fugiat soluta.
Cupiditate eum provident.","187","15A","438","MRT","13","est, in, quis, mollitia, exercitationem"
"126","Repellat alias non expedita maxime et.","Laborum velit odit animi.
Fugiat vel corporis sit iste corrupti atque.
Dignissimos ab ut voluptatem cupiditate incidunt tempore magni fugit.
Minus explicabo enim.","860","TV-Y","20","DJI","35","sunt, repudiandae, iusto, quas, quia"
"127","Tenetur cumque veritatis consequatur eum quaerat enim ex quia cumque.","Nam aut consequatur quasi esse et neque et expedita praesentium.
Vitae dolor qui reiciendis.
Optio veritatis aliquid vero iste.
Dolorem enim sit aperiam temporibus.
Facere quasi enim dolores sunt non.","1460","R16","324","RWA","17","sit, reiciendis, excepturi, soluta, sit"
"128","Corrupti reprehenderit eum corporis et porro animi porro libero.","Maxime quas dolores tenetur veritatis quidem nulla reprehenderit facere.
Voluptas suscipit magni voluptatem fuga magni vero laboriosam dolorem.
Nihil tempora praesentium in omnis similique qui placeat.
Doloremque modi qui distinctio maxime pariatur quo a consequatur aperiam.
Corrupti ea animi iste et voluptas cupiditate nostrum rerum.","621","TV-Y7","985","VEN","35","sit, voluptas, libero, repellendus, fugit"
"129","Quo quod dolorem error voluptatem suscipit earum labore.","Quos quis nemo laboriosam non unde.
Vel iste ea quos quo est.
Neque ut aut unde ex placeat non quod magnam.
Adipisci inventore sed consectetur.
Enim magni voluptatum voluptatem corporis delectus at.","1999","TV-PG","276","THA","3","expedita, vel, amet, voluptatum, ex"
"130","Exercitationem aut adipisci rerum excepturi suscipit temporibus.","Est laborum voluptas ut est.
Et ullam blanditiis.","349","18R","869","CCK","1","dolorum, et, sed, quidem, ipsam"
"131","Sunt rem quo repellat dolores.","Tempore totam sapiente odio cum vel atque voluptas hic vero.
Porro et quos molestiae ut quia consequatur autem maxime atque.
Corrupti ipsa dolor necessitatibus.","1705","A","865","TWN","2","architecto, quibusdam, repellendus, aut, deleniti"
"132","Necessitatibus assumenda voluptas qui accusamus assumenda molestiae voluptatum.","Maiores aliquid et vitae sint mollitia eaque non quos molestiae.
Nulla ab dignissimos autem quae.
Inventore fugit nisi accusantium quis explicabo.
Nulla aliquid numquam sint qui.
Iusto et accusamus fugiat porro cupiditate culpa velit.","1796","TV-14","524","BOL","1","quia, officiis, mollitia, consectetur, et"
"133","Perspiciatis est quaerat deleniti expedita non omnis cum distinctio tempore.","Ex accusamus nesciunt libero.
Et quia inventore soluta quos deleniti perferendis minima fugit.
Sunt quia suscipit et.
Et quia reiciendis.","1053","GP","949","COK","1","est, vitae, molestiae, dignissimos, cumque"
"134","Rerum eum ex consequatur atque deserunt omnis.","Voluptatum pariatur quasi vel error vitae ut dignissimos.
Reiciendis est nam quo.
Hic soluta consequatur sint.","1733","12","827","MNE","13","qui, deserunt, ut, ipsum, quae"
"135","Esse aut et.","Quae sapiente ea dolor id quia unde atque distinctio.
Repellat voluptas voluptas.
Est voluptas repellendus sequi dolorem perspiciatis autem rerum nostrum aliquid.
Error quod quis illo.
Cum sequi at dolores suscipit.
Necessitatibus voluptatem nostrum at quia quis tempore in qui modi.","2075","R18","948","THA","41","enim, repellendus, consequatur, excepturi, quis"
"136","Perspiciatis nulla nemo asperiores esse voluptatem dignissimos suscipit similique aut.","Voluptas et alias accusamus reiciendis est laboriosam voluptatem earum.
Odio odio qui assumenda reprehenderit occaecati id.
Rerum ut quo in a provident perspiciatis.
Qui fugiat corporis.
Est minima aut atque sit.","1450","TV-Y7","687","TWN","42","maxime, voluptas, numquam, et, reiciendis"
"137","Inventore voluptatem dolorem aut repudiandae voluptate autem.","Dolor cupiditate quae.
Ut consequuntur iste ut quas amet modi et at quasi.
A fuga et quasi tempora temporibus.
Est esse eaque.","1004","R21","562","PRI","17","provident, reiciendis, placeat, amet, voluptas"
"138","Quos corrupti voluptatem libero facilis et.","Totam nemo deserunt ab totam unde aut odit.
Corporis totam aliquid sint cupiditate corrupti ut velit voluptatum.
Fugiat dicta quia molestiae in nisi et sit architecto fugit.
Magnam quaerat beatae et sint enim ipsum.","1191","9","808","GBR","45","nobis, minus, quos, in, ipsam"
"139","Quidem sed et.","Harum magni sit quasi corporis voluptatem fugiat similique.
Quam voluptas rerum autem harum consectetur.
Amet inventore quibusdam quos.
Sunt veniam provident quibusdam ipsam omnis non necessitatibus.
Ipsam velit et rerum.
Nisi quia et unde consequuntur quas quis quo.","1796","M","689","STP","46","eum, veniam, ut, aut, expedita"
"140","Nihil cupiditate rerum animi ut nisi aut iure illo dolorum.","Voluptas nostrum eos enim architecto molestiae accusantium.
Omnis necessitatibus est.","259","E10+","852","BVT","2","neque, est, aperiam, dolore, atque"
"141","Adipisci consequatur ullam quia.","Est rerum dolor.
Occaecati expedita rerum dolores ipsum voluptatem repellat dicta.
Qui ad fugit sit.
Et nemo enim eveniet modi.","1989","TV-G","275","NLD","1","et, animi, tenetur, molestiae, distinctio"
"142","Eum molestiae accusantium maiores aspernatur.","Numquam dignissimos animi officiis.
Qui assumenda incidunt atque dolorem.
Doloribus nihil laboriosam voluptatem natus facere et sequi.
Sed deserunt voluptatum deleniti dolores est nulla eum iste quibusdam.
Ullam possimus voluptas odit reiciendis.","375","15A","725","BHS","17","sint, et, qui, ut, natus"
"143","Odit cupiditate et qui quis ut ut temporibus vel.","Sunt voluptatum rerum ut animi maiores exercitationem natus.
Autem dolorem et.
Doloremque error expedita est dolores accusantium dolorem tempore est.
Perspiciatis nostrum unde explicabo eos accusantium mollitia soluta earum.
Dolorem illum quia reprehenderit eveniet corporis.","690","NC-17","693","MSR","21","et, accusantium, dolorem, rerum, nam"
"144","Laborum repudiandae et aliquid vitae in ipsam.","Ut ipsam nulla.
Ducimus provident est doloribus.","1584","TV-MA","726","CYP","3","ducimus, nostrum, pariatur, a, sit"
"145","Consequuntur ullam perferendis necessitatibus illum nam sed.","Accusamus vero velit rem necessitatibus facere quae et iste dolor.
Maiores ducimus et et dolores exercitationem.
Et dolorem numquam dolorem et vel sit reiciendis quo dolores.","1094","TV-PG","87","VEN","46","saepe, molestias, sunt, culpa, quibusdam"
"146","Aliquam eaque necessitatibus nesciunt dolores nihil vel non hic.","Ipsa pariatur molestiae eius soluta atque qui deserunt fugiat perspiciatis.
Tempore beatae non.
Nam et sit quae aut libero eveniet et delectus.","2081","X18","701","STP","9","ipsum, qui, quia, voluptatem, voluptatem"
"147","At rem ut est exercitationem temporibus repellat expedita.","Quisquam quae eius eaque.
A porro animi aut qui tempora.
Fugiat sed et quo et quis ducimus a est.
Qui provident nesciunt eligendi non.
Dolor corporis non quia velit suscipit.
Et doloribus laudantium aut.","1096","TV-14","408","GTM","2","inventore, ad, qui, beatae, veniam"
"148","Consectetur consequatur ut reprehenderit tenetur.","Aut reprehenderit in dolorem architecto suscipit quasi.
Qui molestiae saepe voluptatem et sunt.
Aut voluptatem sint dolores veniam ullam aspernatur.
Cum aut ut voluptates voluptatibus repudiandae voluptas voluptates et.
Saepe temporibus ducimus nihil qui soluta officiis quis occaecati facilis.","2040","TV-PG","752","FSM","35","consequatur, non, voluptatem, qui, sunt"
"149","Molestias hic dolore quaerat tempore.","Non culpa eveniet voluptatibus quas.
Quia nobis quo perferendis dolores et illo.
Nisi ut ut eius nisi earum asperiores qui.","575","12A","482","EGY","16","officia, aut, nostrum, animi, vero"
"150","Odio officia doloremque dolore.","Voluptas doloremque voluptatum.
Quidem est numquam nobis.
Et consequatur tempora nam aliquid minima necessitatibus.
Architecto ut omnis dolores consequatur aut.","1989","E10+","812","ROU","11","autem, incidunt, eveniet, sit, reprehenderit"
"151","Similique impedit accusamus fuga ex non eos velit sed.","Accusamus saepe velit eum consectetur unde quod.
Quos odit deleniti alias.
Doloremque a architecto explicabo.
Libero voluptas repellat tenetur quod voluptatem fugit.","1818","C","87","PRI","37","dignissimos, provident, ea, maxime, error"
"152","Voluptatum veniam inventore sed expedita earum in.","Repellat vero perferendis nihil.
Magnam rerum ipsam nemo ut.
Nihil qui deserunt sit.
Ea quae sint aliquid blanditiis molestiae.
Quia aperiam voluptate voluptas fugiat labore quos eligendi occaecati.","1130","NC-17","667","SXM","45","odio, saepe, suscipit, aperiam, incidunt"
"153","Aspernatur voluptatem sunt magnam voluptatum sint aut sequi maxime quos.","Voluptates corrupti quis.
Illo saepe nisi rerum unde et sed voluptas amet occaecati.","784","9","368","PRT","26","fuga, quia, reiciendis, dignissimos, molestiae"
"154","Similique ut deleniti quisquam quos et reiciendis qui fugiat.","Optio minus voluptatem et.
Magni maiores quod.
Qui voluptatem consequatur sunt rerum atque mollitia.
Voluptas quae ipsam ab.
Sunt modi sint qui animi non quisquam ut voluptas.
Voluptatem aliquid quod perspiciatis.","1733","GP","888","BGR","28","molestiae, fuga, sint, rerum, doloremque"
"155","Illo eum molestiae est minima consequuntur consequuntur ut tempore.","Excepturi enim odio nisi sit.
Iusto ut sed cumque.
Error accusamus quasi nam rem.
Consequatur fugiat fugiat nostrum cum eos ut.","1866","M/PG","415","LKA","20","inventore, animi, quasi, quisquam, tempora"
"156","Adipisci dolorem eligendi.","Voluptates incidunt eos et ut et dicta repellat minus.
Alias eligendi sit delectus itaque ducimus dolorem.
Ratione numquam facilis asperiores soluta ipsam sint doloribus modi rerum.
Laboriosam qui et possimus porro.
Ullam nemo veniam amet accusantium asperiores aut sit.
Sit quis aut vero corrupti facilis nobis esse modi.","1232","9","277","GLP","11","deserunt, voluptatem, excepturi, sed, earum"
"157","Maiores quaerat cumque sint soluta architecto voluptate voluptatem.","Quia provident reprehenderit atque esse non.
Voluptatem aliquam inventore est sequi nihil eveniet in repudiandae.
Quia eius harum vel eos et eum repellendus ex non.
Quibusdam itaque et nulla distinctio odit.
Ut quidem facilis facere fugiat aspernatur ut.
Ex distinctio placeat placeat.","929","12","170","REU","11","dicta, laborum, nemo, voluptate, dolorem"
"158","Veritatis enim temporibus non aut ut veniam.","Ea id cum aperiam fugiat harum et laborum.
Sit ut necessitatibus maxime et earum.
Dolorem ea est vitae eum enim molestiae officiis ut saepe.
Aut eos numquam nobis expedita.
Earum dolorem error.
Qui tempora officiis nemo non officia.","825","12","804","SLV","25","illum, est, eos, qui, aliquam"
"159","Voluptatibus in earum fuga maiores dolor deleniti.","Aliquid et dolor enim iure sint.
Ratione aut eum.
Neque dolorum quas blanditiis ducimus quia porro excepturi enim.
Molestiae alias dignissimos animi.
Hic totam ex officiis nostrum maiores dolore culpa quis totam.
Odio nobis ad qui quis et ut.","1087","G","808","STP","2","in, qui, quo, rem, numquam"
"160","Ratione error unde sit inventore.","Fuga delectus pariatur itaque harum facilis pariatur omnis mollitia enim.
Omnis nesciunt accusamus.","1664","M/PG","986","FRO","7","rerum, pariatur, dolor, itaque, at"
"161","Quae accusantium accusamus distinctio eius aperiam laborum.","Inventore ut ut soluta omnis.
Et quidem molestiae est qui quisquam.
Qui provident nam a delectus explicabo alias.
Iure delectus et omnis similique.","615","6","132","HUN","29","nesciunt, optio, deleniti, dolorem, sed"
"162","A non et culpa voluptatibus sequi et qui voluptatem.","Ratione soluta aut et adipisci aspernatur quas.
Repellendus assumenda voluptatem quo.
Culpa est id provident nobis quod itaque illum voluptatem.
Iure architecto voluptatem odio quibusdam ducimus quia qui.","225","TV-PG","870","SGS","49","aspernatur, eum, impedit, quasi, id"
"163","Repellendus dolorem quo.","Ipsam nemo minus repudiandae.
Optio cumque voluptatum odit cum dicta.
Quibusdam sed aliquam.
Et et vel labore et rerum fugiat.","2021","MA15+","597","USA","39","nostrum, expedita, ut, similique, dolore"
"164","Iusto repellat soluta omnis doloribus.","Totam modi sapiente consequatur voluptatibus.
Repellendus repudiandae nihil.
Illum autem labore sapiente et non.
Sint nobis explicabo ipsa omnis unde qui praesentium soluta.
Quis sint nostrum fugit omnis sed sunt perspiciatis.","1047","NC-17","986","USA","1","explicabo, sunt, aut, ut, quia"
"165","Corporis eum non enim praesentium.","Reprehenderit fugiat vitae ipsam ullam placeat voluptatem.
Molestiae voluptas unde.
Sed aliquam voluptatem.
Iste perferendis est dolor eos omnis quibusdam quaerat.
Saepe non quia animi iusto a perspiciatis laudantium est in.","826","AL","132","SAU","29","iure, ut, architecto, molestiae, corporis"
"166","Modi suscipit non id vel non et eligendi.","Et voluptas magnam impedit ex et ullam et.
Quis dolores nihil rerum.","1384","CA","879","DOM","34","non, eos, labore, beatae, est"
"167","Tenetur cum provident voluptatem nulla itaque.","Vitae eos voluptatem nobis unde totam blanditiis ipsa nisi voluptas.
Perferendis veritatis aut quae cum corrupti autem et sit.
Eaque ea ea.","338","PG","787","AND","50","similique, non, et, dolorem, eum"
